<?xml version="1.0" encoding="UTF-8"?>
<!DOCTYPE studentrecords SYSTEM "Students.dtd">
	<studentrecords>
<Student>
		<fName>april</fName>	
		<lName>may</lName>	
		<status>Provisional</status>	
		<major>Nursing</major>	
	</Student>
	<Student>
		<fName>Keely</fName>	
		<lName>lyons</lName>	
		<status>Full-Time</status>	
		<major>HDFS</major>	
	</Student>
	<Student>
		<fName>Mike</fName>	
		<lName>nied</lName>	
		<status>Part-Time</status>	
		<major>IST</major>	
	</Student>
</studentrecords>